{
  "schema_version": "0.1",
  "agent": {
    "name": "claude"
  },
  "config_hash": "abc123",
  "captured_at": "2026-03-13T10:00:00Z",
  "config_files": [
    {
      "path": "CLAUDE.md",
      "sha256": "ed7002b439e9ac845f22357d822bac1444730fbdb6016d3ec9432297b9ec9f73",
      "size": 7,
      "content": "Y29udGVudA=="
    }
  ]
}
